{
  "target": "0x2222222222222222222222222222222222222222",
  "chainId": 11155111,
  "verdict": "MEDIUM",
  "riskScore": 30,
  "verified": true,
  "findings": [
    {
      "id": "tx-origin",
      "severity": "medium",
      "message": "uses tx.origin (phishing-prone auth) (in emergencyWithdraw, line 29)"
    },
    {
      "id": "unchecked-low-level-call",
      "severity": "medium",
      "message": "return value of .call() ignored (in sweep, line 41)"
    }
  ]
}
