{
  "target": "0x3333333333333333333333333333333333333333",
  "chainId": 11155111,
  "verdict": "HIGH",
  "riskScore": 50,
  "verified": false,
  "findings": [
    {
      "id": "eip7702-delegation",
      "severity": "high",
      "message": "address code is an EIP-7702 delegation (prefix 0xef0100): another contract controls what this address does and can change it"
    }
  ]
}
